serial_nr,stationid,lon,lat,site,stationname
3102,08015500,-92.91541670000001,30.50255556,USGS,"Calcasieu River near Kinder, LA"
3103,02307000,-82.5759304,28.03696237,USGS,ROCKY CREEK NEAR SULPHUR SPRINGS FL
3104,02207185,-84.03777779999999,33.7775,USGS,"NO BUSINESS CREEK AT LEE ROAD, BELOW SNELLVILLE,GA"
3105,01480015,-75.6399444,39.71575,USGS,"RED CLAY CREEK NEAR STANTON, DE"
3106,02310300,-82.6429044,28.25731495,USGS,PITHLACHASCOTEE RIVER NEAR NEW PORT RICHEY FL
3107,01475553,-75.25527778,39.898611100000004,USGS,"Darby Creek at 84th St Bridge at Eastwick,PA"
3108,03176500,-80.8606347,37.372898600000006,USGS,"NEW RIVER AT GLEN LYN, VA"
3109,01400000,-74.6791667,40.57055556,USGS,North Branch Raritan River near Raritan NJ
3110,01547950,-77.70221590000001,41.1117307,USGS,"Beech Creek at Monument, PA"
3111,02264100,-81.5206284,28.32528785,USGS,"BONNET CREEK NEAR VINELAND, FL"
3112,08190500,-100.2391667,29.48108333,USGS,"W Nueces Rv nr Brackettville, TX"
3113,07288800,-90.81732509999999,32.487363300000005,USGS,"YAZOO RIVER AT REDWOOD, MS"
3114,02120780,-80.596075,35.717608299999995,USGS,"SECOND CREEK NEAR BARBER, NC"
3115,08010000,-92.4906944,30.48288889,USGS,"Bayou Des Cannes near Eunice, LA"
3116,02301000,-82.10008689,27.8839148,USGS,NORTH PRONG ALAFIA RIVER AT KEYSVILLE FL
3117,02091814,-77.30277778,35.31388889,USGS,"NEUSE RIVER NEAR FORT BARNWELL, NC"
3118,08042950,-97.9182778,33.30758333,USGS,"Big Ck nr Chico, TX"
3119,07312630,-98.4620944,33.98427778,USGS,"Bear Ck at FM 171 nr Wichita Falls, TX"
3120,08057410,-96.73583190000001,32.70763139,USGS,"Trinity Rv bl Dallas, TX"
3121,08077640,-95.1701306,29.436075,USGS,"Dickinson Bayou at FM 517 nr Alvin, TX"
3122,02225500,-82.1765,32.07713889,USGS,"OHOOPEE RIVER NEAR REIDSVILLE, GA"
3123,01185500,-73.0728833,42.078861100000005,USGS,"WEST BRANCH FARMINGTON RIVER NEAR NEW BOSTON, MA"
3124,02438000,-87.9894765,34.10621294,USGS,BUTTAHATCHEE RIVER BELOW HAMILTON AL
3125,08077888,-95.2662889,29.436511100000004,USGS,"Mustang Bayou at SH 6 nr Alvin, TX"
3126,02081094,-76.89277778,35.81305556,USGS,"ROANOKE RIVER AT JAMESVILLE, NC"
3127,07380212,-90.73648890000001,30.10158889,USGS,"Airline Canal at Blind River near Gramercy, LA"
3128,07342500,-95.5949562,33.356499,USGS,"S Sulphur Rv nr Cooper, TX"
3129,02039500,-78.388607,37.3070965,USGS,"APPOMATTOX RIVER AT FARMVILLE, VA"
3130,02181350,-83.405,34.75027778,USGS,"TALLULAH R AT TERRORA PWRHSE, NR TALLULAH FALLS,GA"
3131,02461192,-86.87217220000001,33.492611100000005,USGS,"VALLEY CREEK AT AVE W NEAR ENSLEY, AL"
3132,02083500,-77.5330556,35.89444444,USGS,"TAR RIVER AT TARBORO, NC"
3133,01350000,-74.4366667,42.31944444,USGS,SCHOHARIE CREEK AT PRATTSVILLE NY
3134,01464984,-75.0537809,40.240663500000004,USGS,"L Neshaminy Cr at Walton Road nr Jacksonville, PA"
3135,0214643860,-80.8058333,35.2061111,USGS,"BRIAR CR BL EDWARDS BRANCH NEAR CHARLOTTE, NC"
3136,01172500,-72.02452120000001,42.42509025,USGS,"WARE RIVER NEAR BARRE, MA"
3137,01473500,-75.35611109999999,40.11555556,USGS,"Schuylkill River at Norristown, PA"
3138,01674182,-77.3434444,37.960333299999995,USGS,"POLECAT CREEK AT ROUTE 301 NEAR PENOLA, VA"
3139,08042558,-94.66611390000001,29.67555556,USGS,"W Fk Double Bayou at Eagle Ferry Rd nr Anahuac, TX"
3140,01175500,-72.3325824,42.267869899999994,USGS,"SWIFT RIVER AT WEST WARE, MA"
3141,01389492,-74.2344444,40.88444444,USGS,Passaic River abv Beatties Dam at Little Falls NJ
3142,02130900,-80.18312440000001,34.51404244,USGS,"BLACK CREEK NEAR MCBEE, SC"
3143,03558000,-84.24,34.79,USGS,"TOCCOA RIVER NEAR DIAL, GA"
3144,01446995,-75.2033333,40.69444444,USGS,Delaware River at US Route 22 at Phillipsburg NJ
3145,02294655,-81.80444440000001,27.88305556,USGS,PEACE RIVER NEAR BARTOW FL
3146,02470072,-87.7472247,31.86404249,USGS,"BASSETT CREEK AT US HIGHWAY 43 NR THOMASVILLE, AL."
3147,02423555,-86.8824901,33.28455786,USGS,CAHABA RIVER NEAR HELENA AL
3148,01389550,-74.2222222,40.87194444,USGS,Peckman River at Little Falls NJ
3149,02160300,-82.24289190000002,34.8726177,USGS,"ENOREE RIVER AT BATESVILLE, SC"
3150,02160000,-81.68636109999998,34.6818333,USGS,"FAIRFOREST CREEK NEAR UNION, SC"
3151,01036390,-68.69666670000001,44.82666667,USGS,"Penobscot River at Eddington, Maine"
3152,08063800,-96.6402676,32.2434807,USGS,"Waxahachie Ck nr Bardwell, TX"
3153,01346000,-74.98827778,43.06852778,USGS,WEST CANADA CREEK AT KAST BRIDGE NY
3154,04273800,-73.4963333,44.59427778,USGS,LITTLE AUSABLE RIVER NEAR VALCOUR NY
3155,08100000,-98.1214238,31.78876325,USGS,"Leon Rv nr Hamilton, TX"
3156,02475000,-88.8083222,31.10741389,USGS,"LEAF RIVER NR MCLAIN, MS"
3157,01413398,-74.60138889,42.150833299999995,USGS,BUSH KILL NEAR ARKVILLE NY
3158,04219915,-78.2645278,43.360833299999996,USGS,JOHNSON CREEK AT KUCKVILLE NY
3159,01467086,-75.1121191,40.04261157,USGS,"Tacony Creek ab Adams Avenue, Philadelphia, PA"
3160,01480685,-75.71632459,40.05538195,USGS,"Marsh Creek near Downingtown, PA"
3161,03042500,-79.171701,40.517289899999994,USGS,"Two Lick Creek at Graceton, PA"
3162,01671100,-77.5130392,37.8726401,USGS,"LITTLE RIVER NEAR DOSWELL, VA"
3163,02166975,-82.1553992,34.21567778,USGS,"SAMPLE BRANCH AT GREENWOOD, SC"
3164,07291000,-90.7775,31.50305556,USGS,"HOMOCHITTO RIVER AT EDDICETON, MS"
3165,08059590,-96.6391389,33.18513889,USGS,"Wilson Ck Dws of Hwy 75 at McKinney, TX"
3166,01029200,-68.6336111,46.14305556,USGS,"Seboeis River near Shin Pond, Maine"
3167,01135500,-72.0392613,44.36561470000001,USGS,"PASSUMPSIC RIVER AT PASSUMPSIC, VT"
3168,01437100,-74.4681944,41.59594444,USGS,GUMAER BROOK NEAR WURTSBORO NY
3169,03036501,-79.53051389,40.81780278,USGS,"Allegheny River (lower pool) at Kittanning, PA"
3170,02359500,-85.55659320000001,30.3846406,USGS,"ECONFINA CREEK NEAR BENNETT, FLA."
3171,08050400,-97.1564016,33.62427479,USGS,"Elm Fk Trinity Rv at Gainesville, TX"
3172,02392360,-84.5954444,34.2633333,USGS,"SHOAL CREEK AT GA 108, NEAR WALESKA, GA"
3173,02365769,-85.9424358,30.624636300000002,USGS,"BRUCE CREEK AT SH 81 NR REDBAY, FL"
3174,02318500,-83.4534444,30.79330556,USGS,"WITHLACOOCHEE RIVER AT US 84, NEAR QUITMAN, GA"
3175,02368500,-86.3068906,30.7960205,USGS,"SHOAL RIVER NR MOSSY HEAD, FLA."
3176,03108500,-80.38867540000001,40.64728794,USGS,"Ohio River at Montgomery Lock & Dam, Lower Pool"
3177,01570500,-76.88608459999999,40.25481164,USGS,"Susquehanna River at Harrisburg, PA"
3178,01108410,-71.0894897,41.8998232,USGS,"MILL RIVER AT SPRING STREET AT TAUNTON, MA"
3179,01374701,-73.66797220000001,41.358000000000004,USGS,WEST BRANCH CROTON RIVER NEAR CROTON FALLS NY
3180,02423160,-86.5491517,33.60371416,USGS,CAHABA RIVER NEAR WHITES CHAPEL AL
3181,03102500,-80.376178,41.42199889,USGS,"Little Shenango River at Greenville, PA"
3182,02310742,-82.6055556,28.893361100000003,USGS,CRYSTAL RIVER AT MOUTH OF KINGS BAY FL
3183,03028500,-78.6783595,41.48617269,USGS,"Clarion River at Johnsonburg, PA"
3184,01518862,-77.5319298,41.92312576,USGS,"Cowanesque River at Westfield, PA"
3185,50128925,-66.94971559,18.04258528,USGS,CANAL DE RIEGO DE LAJAS BLW MAJINAS FILT. PLANT PR
3186,01131500,-71.72064379999999,44.4100591,USGS,"CONNECTICUT RIVER NEAR DALTON, NH"
3187,03022540,-80.04811219,41.690611499999996,USGS,"Woodcock Creek at Blooming Valley, PA"
3188,08178871,-99.3792778,29.78013889,USGS,"W Prong Medina Rv at Carpenter Ck Rd nr Medina, TX"
3189,02146562,-80.7366667,35.18666667,USGS,"CAMPBELL CREEK NR CHARLOTTE, NC"
3190,02336152,-84.2479722,33.81044444,USGS,"SOUTH FORK PEACHTREE AT CASA DR, NR CLARKSTON, GA"
3191,02169000,-81.08787170000001,34.014041600000006,USGS,"SALUDA RIVER NEAR COLUMBIA, SC"
3192,07375000,-90.2486954,30.6160223,USGS,"Tchefuncte River near Folsom, LA"
3193,02361500,-85.78437890000001,31.15934229,USGS,CHOCTAWHATCHEE RIVER NEAR BELLWOOD AL
3194,02306774,-82.5658333,28.06583333,USGS,ROCKY CREEK AT ST HWY 587 AT CITRUS PARK FL
3195,07381412,-91.21047220000001,30.432222200000002,USGS,INTRACOASTAL WATERWAY NR PORT ALLEN LA
3196,01184490,-72.5497,41.9138972,USGS,"BROAD BROOK AT BROAD BROOK, CT"
3197,04213508,-78.9415556,42.45352778,USGS,THATCHER BROOK AT GOWANDA NY
3198,07378722,-91.0073244,30.38685874,USGS,"Claycut Bayou at Antioch Rd near Baton Rouge, LA"
3199,08026000,-93.5196165,31.06408004,USGS,"Sabine Rv nr Burkeville, TX"
3200,02130840,-80.2116667,34.6633333,USGS,"BLACK CREEK BELOW CHESTERFIELD, SC"
3201,02327355,-83.93902779999999,31.00241667,USGS,"OCHLOCKONEE RIVER AT GA 188, NEAR COOLIDGE, GA"
3202,021556525,-81.8556592,35.0476231,USGS,"PACOLET RIVER BELOW LAKE BLALOCK NEAR COWPENS, SC"
3203,01187300,-72.93932778,42.0375,USGS,"HUBBARD RIVER NEAR WEST HARTLAND, CT"
3204,02358789,-85.2163178,30.77297064,USGS,CHIPOLA RIVER AT MARIANNA FL
3205,01076500,-71.68563370000001,43.7592388,USGS,"PEMIGEWASSET RIVER AT PLYMOUTH, NH"
3206,01549760,-77.2510812,41.2022951,USGS,"WB Susquehanna River at Jersey Shore, PA"
3207,02093800,-79.95277779999999,36.1725,USGS,"REEDY FORK NEAR OAK RIDGE, NC"
3208,02202500,-81.41586109999999,32.1901111,USGS,"OGEECHEE RIVER NEAR EDEN, GA"
3209,08178800,-98.41279250000001,29.35718017,USGS,"Salado Ck at Loop 13, San Antonio, TX"
3210,08447020,-101.7319167,30.45075,USGS,"Independence Ck nr Sheffield, TX"
3211,03078000,-79.13638889,39.70219444,USGS,"CASSELMAN RIVER AT GRANTSVILLE, MD"
3212,02423630,-86.9497141,33.326223399999996,USGS,SHADES CREEK NEAR GREENWOOD AL
3213,04213500,-78.9345278,42.46344444,USGS,CATTARAUGUS CREEK AT GOWANDA NY
3214,02232155,-80.89533730000001,28.18195808,USGS,"PENNYWASH CREEK NEAR DEER PARK, FL"
3215,01305000,-72.90613889,40.83016667,USGS,CARMANS RIVER AT YAPHANK NY
3216,01349700,-74.30277778,42.24916667,USGS,EAST KILL NEAR JEWETT CENTER NY
3217,02444161,-88.28864540000001,33.21040097,USGS,"TOMBIGBEE RIVER BEL BEVIL L&D NR PICKENSVILLE, AL."
3218,02160105,-81.548158,34.535416299999994,USGS,"TYGER RIVER NEAR DELTA, SC"
3219,02481510,-89.27444440000001,30.483611100000005,USGS,"WOLF RIVER NR LANDON, MS"
3220,07379960,-91.09427120000001,30.38241445,USGS,"Dawson Cr. at Bluebonnet Blvd near Baton Rouge, LA"
3221,08174600,-97.3166565,29.47412787,USGS,"Peach Ck bl Dilworth, TX"
3222,01427195,-75.2383333,41.84027778,USGS,"Equinunk Creek near Dillontown, PA"
3223,01464645,-75.2065626,40.31232805,USGS,"NB Neshaminy Cr bl Lake Galena nr New Britain, PA"
3224,02223190,-83.1930556,32.84994444,USGS,"COMMISSIONER CREEK AT US 441, AT MCINTYRE, GA"
3225,01184000,-72.6053669,41.9873186,USGS,"CONNECTICUT RIVER AT THOMPSONVILLE, CT"
3226,073816525,-91.3338889,29.43025,USGS,Mouth of Atchafalaya River at Atchafalaya Bay
3227,02354475,-84.4494444,31.46555556,USGS,"SPRING CREEK NEAR LEARY, GA"
3228,023312495,-83.52888889,34.6186111,USGS,"SOQUE RIVER AT GA 197, NEAR CLARKESVILLE, GA"
3229,07381567,-91.5251136,29.983535600000003,USGS,"Buffalo Cove at Round Island near Charenton, LA"
3230,08178638,-98.448825,29.629386100000005,USGS,"W Elm Ck at Encino Rio at San Antonio, TX"
3231,01179500,-72.8642636,42.28786655,USGS,"WESTFIELD RIVER AT KNIGHTVILLE, MA"
3232,02203960,-84.1986111,33.69666667,USGS,"SNAPFINGER CR AT THOMPSON MILL RD NR LITHONIA, GA"
3233,07349000,-93.3320309,32.59759468,USGS,"Bayou Dorcheat near Minden, LA"
3234,08061540,-96.6144378,32.95984447,USGS,"Rowlett Ck nr Sachse, TX"
3235,02320700,-82.2195493,29.84635394,USGS,"SANTA FE RIVER NEAR GRAHAM, FLA."
3236,02200120,-82.6036667,33.04458333,USGS,"OGEECHEE RIVER AT GA 88, NEAR GRANGE, GA"
3237,02237206,-81.88424640000001,28.71499294,USGS,"PALATLAKAHA R AT STRUCTURE M-4 NR OKAHUMPKA, FL"
3238,01315500,-73.9831944,43.700861100000004,USGS,HUDSON RIVER AT NORTH CREEK NY
3239,02336106,-84.3219444,33.84166667,USGS,"N FK PEACHTREE CR AT BRIARWOOD RD, NR ATLANTA, GA"
3240,08048970,-97.2650142,32.60346909,USGS,"Village Ck at Everman, TX"
3241,02176500,-81.1317718,32.836277700000004,USGS,"COOSAWHATCHIE RIVER NEAR HAMPTON, SC"
3242,01585200,-76.5843333,39.37363889,USGS,"WEST BRANCH HERRING RUN AT IDLEWYLDE, MD"
3243,0209725960,-78.9269417,35.95118056,USGS,"THIRD FORK CREEK AT M.L. KING PARKWAY AT DURHAM,NC"
3244,02480590,-88.89336429999999,30.476030699999995,USGS,"TCHOUTACABOUFFA RIVER NR D'IBERVILLE, MS"
3245,08196000,-99.78144520000001,29.50467576,USGS,"Dry Frio Rv nr Reagan Wells, TX"
3246,03165000,-80.9192444,36.645961299999996,USGS,"CHESTNUT CREEK AT GALAX, VA"
3247,02146300,-80.9044444,35.19777778,USGS,"IRWIN CREEK NEAR CHARLOTTE, NC"
3248,02428400,-87.55054799999999,31.61515849,USGS,ALABAMA RIVER AT CLAIBORNE L&D NEAR MONROEVILLE
3249,01388910,-74.2705556,40.91444444,USGS,Pompton River at Mountain View NJ
3250,01208873,-73.21900219,41.1798189,USGS,"ROOSTER RIVER AT FAIRFIELD, CT"
3251,02447025,-88.1561363,32.8481856,USGS,"TOMBIGBEE R AT HEFLIN L&D NR GAINESVILLE, AL"
3252,0208735012,-78.66638889,35.78,USGS,"ROCKY BRANCH BELOW PULLEN ROAD AT RALEIGH, NC"
3253,50055000,-66.00919819,18.24070482,USGS,"RIO GRANDE DE LOIZA AT CAGUAS, PR"
3254,02131472,-80.58285140000001,34.51626465,USGS,"HANGING ROCK CREEK NR KERSHAW, SC"
3255,03081000,-79.3725353,39.8275767,USGS,"Youghiogheny River below Confluence, PA"
3256,01422779,-75.1289167,42.17738889,USGS,WEST BROOK AT AUSTIN LINCOLN PARK AT WALTON NY
3257,02399600,-85.68677220000001,34.139436100000005,USGS,"COOSA RIVER AT CENTRE, AL"
3258,07370600,-92.3211111,32.10916667,USGS,"BEAUCOUP CK NR COTTON PLANT, LA"
3259,01572025,-76.4021793,40.53258999,USGS,"Swatara Creek near Pine Grove, PA"
3260,04288230,-72.78178829999999,44.503941299999994,USGS,"RANCH BROOK AT RANCH CAMP, NEAR STOWE, VT"
3261,021968385,-82.09873889,33.42509167,USGS,"BUTLER CR BELOW BUTLER CR RSVR AT FORT GORDON, GA"
3262,01068910,-70.7380556,43.4183333,USGS,"Mousam River at Route 4 near Sanford, Maine"
3263,01434498,-74.57438889,41.92041667,USGS,WEST BRANCH NEVERSINK RIVER AT CLARYVILLE NY
3264,0214676115,-80.8916667,35.040833299999996,USGS,"MCALPINE CREEK AT SR2964 NR CAMP COX, SC"
3265,02398000,-85.3348333,34.46780556,USGS,"CHATTOOGA RIVER AT SUMMERVILLE, GA"
3266,01089500,-71.36951248,43.25674759,USGS,"SUNCOOK RIVER AT NORTH CHICHESTER, NH"
3267,01507000,-75.77138889,42.32444444,USGS,CHENANGO RIVER AT GREENE NY
3268,02294161,-81.7955556,27.92444444,USGS,PEACE CREEK NEAR BARTOW FL
3269,02311000,-82.0978598,28.27139707,USGS,"WITHLACOOCHEE-HILLSBOROUGH OVFLO NEAR RICHLAND, FL"
3270,04218000,-78.6361667,43.0935,USGS,TONAWANDA CREEK AT RAPIDS NY
3271,07287404,-90.1734194,33.10179419,USGS,"HARLAND CREEK NR HOWARD, MS"
3272,02485720,-90.12777779999999,32.370361100000004,USGS,"WHITE OAK CREEK AT WESTBROOK ROAD AT JACKSON, MS"
3273,02089000,-77.9975,35.3375,USGS,"NEUSE RIVER NEAR GOLDSBORO, NC"
3274,01475001,-75.1144444,39.73888889,USGS,Mantua Creek at East Holly Avenue at Pitman NJ
3275,02055100,-79.9353193,37.41763318,USGS,"TINKER CREEK NEAR DALEVILLE, VA"
3276,02372422,-86.51968259999998,31.3612799,USGS,"CONECUH RIVER BEL PT A DAM NR RIVER FALLS, AL."
3277,50081000,-65.8690463,18.17207287,USGS,"RIO HUMACAO AT LAS PIEDRAS, PR"
3278,01429500,-75.26710469,41.607218100000004,USGS,"Dyberry Creek near Honesdale, PA"
3279,0208114150,-76.72277778,35.915,USGS,"ROANOKE RIVER AT NC 45 NR WESTOVER, NC"
3280,07369500,-91.36678139,32.43208704,USGS,"Tensas River at Tendal, LA"
3281,03173000,-80.7095125,37.26817845,USGS,"WALKER CREEK AT BANE, VA"
3282,07370500,-92.2065,32.08158333,USGS,"Castor Ck nr Grayson, LA"
3283,02351890,-84.1390833,31.77627778,USGS,"MUCKALEE CREEK AT GA 195, NEAR LEESBURG, GA"
3284,03441000,-82.7058333,35.27305556,USGS,"DAVIDSON RIVER NEAR BREVARD, NC"
3285,0208735460,-78.6238333,35.75788889,USGS,"WALNUT CREEK AT SOUTH STATE STREET AT RALEIGH, NC"
3286,02237700,-81.6847976,28.72249444,USGS,"APOPKA-BEAUCLAIR CANAL NEAR ASTATULA, FL"
3287,03575700,-86.54110169,34.623980100000004,USGS,ALDRIDGE CREEK NEAR FARLEY AL
3288,02490193,-89.84638890000001,30.70583333,USGS,"Pearl River at Pools Bluff near Bogalusa, LA"
3289,01171500,-72.66509070000001,42.31897839,USGS,"MILL RIVER AT NORTHAMPTON, MA"
3290,02294261,-81.90215,28.057347200000002,USGS,LAKE PARKER OUTLET AT COMBEE SETTLEMENT FL
3291,01115190,-71.70034528,41.8223213,USGS,"DOLLY COLE BK AT OLD DANIELSON PK AT S FOSTER, RI"
3292,08136500,-99.9195226,31.5159908,USGS,"Concho Rv at Paint Rock, TX"
3293,0817887350,-99.2485944,29.79389167,USGS,"Medina Rv at Patterson Rd at Medina, TX"
3294,02237050,-81.8845239,28.67888315,USGS,"PALATLAKAHA RIVER AT S M-5 NEAR OKAHUMPKA, FL"
3295,02172525,-81.6850278,33.6053611,USGS,"SHAW CREEK NEAR AIKEN, SC"
3296,50093110,-66.26681229,17.98095749,USGS,"CANAL DE PATILLAS AT INTAKE 113 SALINAS, PR"
3297,01470779,-76.1716128,40.4134258,USGS,"Tulpehocken Creek near Bernville, PA"
3298,012035055,-73.2731833,41.4065472,USGS,POOTATUCK RIVER AT BERKSHIRE
3299,08050800,-96.9472267,33.55455428,USGS,"Timber Ck nr Collinsville, TX"
3300,02168810,-81.2278056,33.97677778,USGS,"TWELVE MILE CREEK AT LEXINGTON, SC"
3301,08085500,-99.21538890000001,32.93297778,USGS,"Clear Fk Brazos Rv at Ft Griffin, TX"
3302,021720709,-79.91008690000001,32.80239835,USGS,"COOPER RIVER AT U.S. HWY 17 AT CHARLESTON, SC"
3303,08072520,-95.6457306,29.7555972,USGS,"Clodine Ditch at Noble Rd nr Addicks, TX"
3304,07385765,-91.5862248,29.87937163,USGS,"Bayou Teche at Adeline Bridge near Jeanerette, LA"
3305,50075500,-65.78460718,18.23884539,USGS,"RIO BLANCO AT FLORIDA, PR"
3306,0212414900,-80.7158333,35.33277778,USGS,"MALLARD CR BL STONY CR NR HARRISBURG, NC"
3307,01392170,-74.18777778,40.8,USGS,Third River at Bloomfield NJ
3308,02342937,-85.2138,32.016786100000004,USGS,"South Fork Cowikee Creek nr Howe, AL"
3309,01491000,-75.7858056,38.99719444,USGS,"CHOPTANK RIVER NEAR GREENSBORO, MD"
3310,0208732593,-78.62025279999999,35.8029583,USGS,"PIGEON HOUSE CREEK AT FENTON STREET AT RALEIGH, NC"
3311,01105585,-70.9972703,42.24787726,USGS,"TOWN BROOK AT QUINCY, MA"
3312,0212419274,-80.73638889,35.50388889,USGS,"CODDLE CR AT SR 1612 NEAR DAVIDSON, NC"
3313,01585219,-76.55513889,39.3179722,USGS,"HERRING RUN AT SINCLAIR LANE AT BALTIMORE, MD"
3314,02344500,-84.4291667,33.24416667,USGS,"FLINT RIVER NEAR GRIFFIN, GA"
3315,08164300,-96.81275600000001,29.466908,USGS,"Navidad Rv nr Hallettsville, TX"
3316,01377500,-74.02111109999998,40.99277778,USGS,Pascack Brook at Westwood NJ
3317,02336120,-84.3427778,33.83155556,USGS,"N.F. PEACHTREE CREEK, BUFORD HWY, NEAR ATLANTA, GA"
3318,0738022295,-90.9634335,30.2621398,USGS,"Grand Goudine at Babin Rd Near Duplessis, LA"
3319,07381588,-91.2393611,29.92238889,USGS,"Intracoastal Waterway southwest of Pierre Part, LA"
3320,02374745,-87.0871928,31.129899100000003,USGS,"BURNT CORN CREEK AT STATE HWY 41 NEAR BREWTON, AL."
3321,03453000,-82.6208333,35.769722200000004,USGS,"IVY RIVER NEAR MARSHALL, NC"
3322,01420500,-74.9796667,41.94641667,USGS,BEAVER KILL AT COOKS FALLS NY
3323,07381670,-91.4705556,29.68083333,USGS,"GIWW at Bayou Sale Ridge near Franklin, LA"
3324,02293090,-81.8086667,26.71571667,USGS,"Popash Creek at Leetana Rd. nr North Fort Myers,FL"
3325,01197000,-73.1973333,42.4695833,USGS,"EAST BRANCH HOUSATONIC RIVER AT COLTSVILLE, MA"
3326,04249000,-76.50527778,43.45166667,USGS,"OSWEGO RIVER AT LOCK 7, OSWEGO NY"
3327,04249200,-75.81397220000001,43.5423611,USGS,NORTH BRANCH SALMON RIVER AT REDFIELD NY
3328,08022500,-94.00630140000001,31.97238949,USGS,"Sabine Rv at Logansport, LA"
3329,02484650,-89.8405556,32.59416667,USGS,"PEARL RIVER AT RATLIFF`S FERRY NR RATLIFF, MS"
3330,07312620,-98.4638056,33.97043889,USGS,"Unnamed Ck at FM 171, Wichita Falls, TX"
3331,02032640,-78.4247323,38.1634674,USGS,"N F RIVANNA RIVER NEAR EARLYSVILLE, VA"
3332,02274325,-80.8383333,27.31638889,USGS,"TAYLOR CREEK AT GRASSY ISLAND NR OKEECHOBEE, FL"
3333,07385500,-91.9306728,30.3974195,USGS,"BAYOU TECHE @ ARNAUDVILLE, LA"
3334,07375800,-90.67343170000001,30.93073559,USGS,"Tickfaw River at Liverpool, LA"
3335,07343000,-95.58773470000001,33.47483009,USGS,"N Sulphur Rv nr Cooper, TX"
3336,0209722970,-78.9568056,35.9832222,USGS,"SANDY CREEK AT CORNWALLIS RD NEAR DURHAM, NC"
3337,02313098,-82.42661109999999,29.07130556,USGS,"RAINBOW RIVER NEAR DUNNELLON, FL"
3338,01362370,-74.31088889,42.10202778,USGS,STONY CLOVE CREEK BLW OX CLOVE AT CHICHESTER NY
3339,01175670,-72.00424179999999,42.26481407,USGS,"SEVENMILE RIVER NEAR SPENCER, MA"
3340,08185025,-98.26288609999999,29.54166667,USGS,"Randolph AFB West Drain nr Shertz, TX"
3341,08074810,-95.5282765,29.672731699999996,USGS,"Brays Bayou at Gessner Dr, Houston, TX"
3342,01049320,-69.7716667,44.318611100000005,USGS,"Kennebec River at Calumet Bridge at Augusta, Maine"
3343,01471000,-75.9791015,40.36898166,USGS,"Tulpehocken Creek near Reading, PA"
3344,0164578734,-77.34113889,38.929661100000004,USGS,"SNAKEDEN BRANCH ABOVE LAKE AUDUBON AT RESTON, VA"
3345,01579905,-76.45288889,39.6751111,USGS,"DEER CREEK AT EDEN MILL DAM NEAR PYLESVILLE, MD"
3346,07385700,-91.82928359999998,30.07103537,USGS,"Bayou Teche at Keystone L&D nr St. Martinville, LA"
3347,0214685800,-80.8285417,35.01035556,USGS,"SIX MILE CREEK NEAR PINEVILLE, NC"
3348,01589316,-76.7506944,39.31891667,USGS,"DEAD RUN TRIBUTARY NEAR WOODLAWN, MD"
3349,02472000,-89.4069444,31.70694444,USGS,"LEAF RIVER NR COLLINS, MS"
3350,02234384,-81.308678,28.71888466,USGS,"SOLDIER CREEK NEAR LONGWOOD, FL"
3351,07343840,-94.8025,33.2747222,USGS,"White Oak Ck at IH 30 nr Omaha, TX"
3352,01480638,-75.6846599,39.9303864,USGS,"Broad Run at Northbrook, PA"
3353,50011085,-67.02750749,18.45534449,USGS,"CANAL DE MOCA ABV LAGO REGULADOR (E13) ISABELA, PR"
3354,01656000,-77.6249897,38.63678689,USGS,"CEDAR RUN NEAR CATLETT, VA"
3355,01581810,-76.78147220000001,39.68980556,USGS,"GUNPOWDER FALLS AT HOFFMANVILLE, MD"
3356,08157560,-97.7397,30.26194167,USGS,"Waller Ck at E 1st St, Austin, TX"
3357,08075763,-95.3132696,29.80883745,USGS,"Hunting Bayou at Hoffman St, Houston, TX"
3358,02352500,-84.1441667,31.59416667,USGS,"FLINT RIVER AT ALBANY, GA"
3359,08080700,-101.7026748,34.17896048,USGS,"Running Water Draw at Plainview, TX"
3360,01644388,-77.31225,39.22338889,USGS,"TENMILE CREEK NEAR CLARKSBURG, MD"
3361,02039000,-78.4863841,37.25709664,USGS,"BUFFALO CREEK NEAR HAMPDEN SYDNEY, VA"
3362,07344500,-94.8821554,33.02095787,USGS,"Big Cypress Ck nr Pittsburg, TX"
3363,02037500,-77.5469314,37.563202200000006,USGS,"JAMES RIVER NEAR RICHMOND, VA"
3364,50114900,-66.64248707,18.09789468,USGS,"RIO PORTUGUES NR TIBES, PR"
3365,011055566,-71.06838369,42.2709321,USGS,"NEPONSET RIVER AT MILTON VILLAGE, MA"
3366,01115276,-71.6672885,41.785377200000006,USGS,"WESTCONNAUG STREAM AT PLAINFIELD PIKE, RI"
3367,02232500,-80.943392,28.54305529,USGS,"ST. JOHNS RIVER NEAR CHRISTMAS, FL"
3368,01374581,-73.73611109999999,41.44994444,USGS,W BR CROTON RIVER BELOW DAM NEAR KENT CLIFFS NY
3369,02198690,-81.2970833,32.36577778,USGS,"EBENEZER CREEK AT SPRINGFIELD, GA"
3370,07282000,-89.3155556,33.8386111,USGS,"YALOBUSHA R AND TOPASHAW C CA AT CALHOUN CITY, MS"
3371,08080505,-99.96013609999999,33.18791667,USGS,"DMF Brazos Rv nr Rule, TX"
3372,02369800,-86.7099567,31.02767985,USGS,BLACKWATER RIVER NEAR BRADLEY AL
3373,01069500,-70.6583333,43.4183333,USGS,"Mousam River near West Kennebunk, Maine"
3374,01441495,-75.2551824,40.9909265,USGS,"Pocono Creek ab Wigwam Run near Stroudsburg, PA"
3375,01518420,-77.27330909,41.842573,USGS,Crooked Cr bl Catlin Hollow at Middlebury Center
3376,07380245,-90.1399806,29.25938889,USGS,"Southwestern Louisiana Canal E of Leeville, LA"
3377,02174055,-80.52438889,33.06166667,USGS,"EDISTO RIVER BELOW CANADYS, SC"
3378,01467042,-75.06906109999998,40.08983289,USGS,"Pennypack Creek at Pine Road, at Philadelphia, PA"
3379,02103000,-78.9855556,35.1933333,USGS,"LITTLE RIVER AT MANCHESTER, NC"
3380,01589230,-76.77959720000001,39.404611100000004,USGS,"RED RUN NEAR OWINGS MILLS, MD"
3381,07372200,-92.3445833,31.754336300000002,USGS,"Little River near Rochelle, LA"
3382,07349650,-93.5104521,32.70236807,USGS,"(COE) Byu Bodcau Lake nr Shreveport, LA (Landside)"
3383,02087183,-78.5808333,35.94,USGS,"NEUSE RIVER NEAR FALLS, NC"
3384,02384540,-84.7212778,34.87194444,USGS,"MILL CREEK NEAR CRANDALL, GA"
3385,01186500,-73.03344440000001,41.967922200000004,USGS,"STILL RIVER AT ROBERTSVILLE, CT"
3386,02338523,-85.22672220000001,33.3407222,USGS,"HILLABAHATCHEE CREEK AT THAXTON RD, NR FRANKLIN,GA"
3387,01332500,-73.15897220000001,42.70025695,USGS,"HOOSIC RIVER NEAR WILLIAMSTOWN, MA"
3388,021622845,-82.705,35.0608333,USGS,"SOUTH SALUDA RIVER NEAR ROCKY BOTTOM, SC"
3389,02425000,-87.1802715,32.44402456,USGS,CAHABA RIVER NEAR MARION JUNCTION AL
3390,04220045,-78.38638889,43.17430556,USGS,OAK ORCHARD CREEK NEAR SHELBY NY
3391,02131455,-80.54646109999999,34.5512656,USGS,"LITTLE LYNCHES RIVER NEAR KERSHAW, SC"
3392,08206910,-98.2416752,28.48610326,USGS,"Choke Canyon Res OWC nr Three Rivers, TX"
3393,02457704,-86.9736073,33.66343834,USGS,"FIVE MILE CREEK NR SAYRE, ALA"
3394,08177300,-97.3172142,28.7516564,USGS,"Perdido Ck at FM 622 nr Fannin, TX"
3395,02477045,-88.74421190000001,32.04237214,USGS,"CHICKASAWHAY RIVER AT QUITMAN, MS"
3396,03048900,-79.6781111,40.7344722,USGS,"Buffalo Creek at Iron Bridge, PA"
3397,023358685,-84.4520278,33.97902778,USGS,"SEWELL MILL CREEK AT GA 120, NEAR MARIETTA, GA"
3398,02342997,-85.1947667,31.8883861,USGS,"Barbour Creek at Barbour Lane nr Eufaula, AL"
3399,02198810,-81.1780278,32.25602778,USGS,"ABERCORN CREEK NEAR SAVANNAH,GA"
3400,02093000,-77.5194444,34.84916667,USGS,"NEW RIVER NEAR GUM BRANCH, NC"
3401,02413205,-85.2525,33.5008333,USGS,"LITTLE TALLAPOOSA R AT REAVESVILLE RD NR BOWDON,GA"
3402,02233475,-81.20784299,28.619998699999996,USGS,"LT ECONLOCKHATCHEE R AT STATE HWY434 NR OVIEDO, FL"
3403,02264004,-81.52535068,28.38917437,USGS,LATERAL 103 BELOW S-103A NR VINELAND
3404,02304510,-82.4345385,28.02113015,USGS,HILLSBOROUGH RIVER AT ROWLETT PK DR NEAR TAMPA FL
3405,01397000,-74.8680556,40.5722222,USGS,South Branch Raritan River at Stanton NJ
3406,08045995,-97.5863889,32.65305556,USGS,"Clear Fork Trinity Rv at Kelly Rd nr Aledo, TX"
3407,08162501,-95.9975,28.77416667,USGS,"Colorado Rv nr Wadsworth, TX"
3408,08206600,-98.54751740000002,28.46749279,USGS,"Frio Rv at Tilden, TX"
