serial_nr,stationid,lon,lat,site,stationname
1863,01475850,-75.43658640000001,39.97649897,USGS,"Crum Creek near Newtown Square, PA"
1864,08185030,-98.26051109999999,29.54143333,USGS,"Randolph AFB East Drain nr Shertz, TX"
1865,01103050,-71.07505177,42.39565236,USGS,"MYSTIC R AT AMELIA EARHART DAM NR SOMERVILLE, MA"
1866,02134900,-79.1342051,34.22599744,USGS,"LUMBER RIVER AT NICHOLS, SC"
1867,07348000,-93.87795849999999,32.6459805,USGS,"Twelvemile Bayou near Dixie, LA"
1868,08090800,-97.9258703,32.61568907,USGS,"Brazos Rv nr Dennis, TX"
1869,02294747,-81.8094778,27.8634972,USGS,SIXMILE CREEK AT BARTOW FL
1870,01308000,-73.31363889,40.7043611,USGS,SAMPAWAMS CREEK AT BABYLON NY
1871,02196000,-82.1817873,33.72929717,USGS,"STEVENS CREEK NEAR MODOC, SC"
1872,01429301,-75.28205278,41.65308889,USGS,"Dyberry Creek at Tanners Falls near Dyberry, PA"
1873,01195399,-72.8148861,41.3335583,USGS,"FARM RIVER AT TOTOKET ROAD AT TOTOKET, CT"
1874,315935081032201,-81.0561111,31.99305556,USGS,"HERB RIVER AT LAROCHE AVENUE, AT ISLE OF HOPE, GA"
1875,08036500,-94.9527152,31.67184364,USGS,"Angelina Rv nr Alto, TX"
1876,01520500,-77.1322222,42.028611100000006,USGS,TIOGA RIVER AT LINDLEY NY
1877,08024480,-93.8946944,31.39508333,USGS,"Palo Gaucho Bayou at FM 2784 nr Milam, TX"
1878,50027000,-66.6206455,18.32410113,USGS,"RIO LIMON ABV LAGO DOS BOCAS, PR"
1879,0214642825,-80.77111109999998,35.2361111,USGS,"BRIAR CREEK NEAR CHARLOTTE, NC"
1880,01100693,-71.0830556,42.77277778,USGS,"MERRIMACK R 0.3 MILES U.S.RT 125 AT HAVERHILL,MA"
1881,07312100,-99.1428495,33.7600934,USGS,"Wichita Rv nr Mabelle, TX"
1882,01389500,-74.2261111,40.8847222,USGS,Passaic River at Little Falls NJ
1883,02292780,-81.5580361,26.70775278,USGS,"TOWNSEND CANAL NEAR ALVA,FL"
1884,08074150,-95.4879965,29.8513369,USGS,"Cole Ck at Deihl Rd, Houston, TX"
1885,02051000,-78.3497182,36.9973738,USGS,"NORTH MEHERRIN RIVER NEAR LUNENBURG, VA"
1886,08086290,-99.0045146,32.64845613,USGS,"Big Sandy Ck abv Breckenridge, TX"
1887,01117800,-71.72062318,41.5739884,USGS,"WOOD RIVER NEAR ARCADIA, RI"
1888,0205373422,-80.1413611,37.16475,USGS,"BOTTOM CREEK BL POOR MTN RD NEAR BENT MOUNTAIN, VA"
1889,0158397967,-76.55725,39.409611100000006,USGS,"MINEBANK RUN NEAR GLEN ARM, MD"
1890,01117350,-71.5511719,41.4823233,USGS,"CHIPUXET RIVER AT WEST KINGSTON, RI"
1891,0422018610,-78.1930556,43.35330556,USGS,OAK ORCHARD CREEK AT THE BRIDGES NY
1892,04220223,-77.9152222,43.3390833,USGS,SANDY CREEK AT NORTH HAMLIN NY
1893,01487000,-75.56186109999999,38.728333299999996,USGS,"NANTICOKE RIVER NEAR BRIDGEVILLE, DE"
1894,02343225,-84.97388889,31.8182222,USGS,"PATAULA CREEK NEAR GEORGETOWN, GA"
1895,02412000,-85.5132894,33.622885,USGS,"TALLAPOOSA RIVER NEAR HEFLIN, AL"
1896,08057200,-96.75666640000001,32.88929207,USGS,"White Rk Ck at Greenville Ave, Dallas, TX"
1897,01018500,-67.42833329999999,45.5683333,USGS,"St. Croix River at Vanceboro, Maine"
1898,01115297,-71.6356207,41.7648219,USGS,WILBUR HOLLOW BK AT OLD PLAINFIELD PK NR CLAYVILLE
1899,02491800,-90.0835,30.72019444,USGS,"Bogue Chitto at Enon, LA"
1900,02300210,-82.21120090000001,27.60197978,USGS,SOUTH FORK LITTLE MANATEE RIVER NEAR PARRISH FL
1901,08161500,-96.4083333,29.515,TX071,"LCRA Colorado Rv nr Garwood, TX"
1902,08017605,-95.81052779999999,32.72952778,USGS,"Mill Ck at CR 1903 nr Fruitvale, TX"
1903,07375430,-90.48425869,30.72907467,USGS,"Tangipahoa River near Amite, LA"
1904,08041780,-94.1143469,30.156878000000003,USGS,"Neches Rv Saltwater Barrier at Beaumont, TX"
1905,08110500,-96.29774300000001,31.17018205,USGS,"Navasota Rv nr Easterly, TX"
1906,04282795,-73.21623670000001,44.370051200000006,USGS,"LAPLATTE RIVER AT SHELBURNE FALLS, VT"
1907,02414715,-85.7396808,32.97734526,USGS,"TALLAPOOSA RIVER NR NEW SITE, AL.(HORSESHOE BEND)"
1908,08065350,-95.6563407,31.33851319,USGS,"Trinity Rv nr Crockett, TX"
1909,01335755,-73.6620622,42.823966399999996,USGS,HUDSON RIVER AT LOCK 1 NEAR WATERFORD NY
1910,03045010,-79.3908333,40.3161111,USGS,"Loyalhanna Creek at Latrobe, PA"
1911,01342730,-75.04166670000001,43.006583299999996,USGS,STEELE CREEK AT ILION NY
1912,08059400,-96.48359690000001,33.29455787,USCE,"USCOE Sister Grove Ck nr Blue Ridge, TX"
1913,08075900,-95.4179936,29.95688886,USGS,"Greens Bayou nr US Hwy 75 nr Houston, TX"
1914,08095200,-97.4694602,31.66960575,USGS,"N Bosque Rv at Valley Mills, TX"
1915,08065420,-96.0022278,31.31018889,USGS,"Lower Keechi Ck at IH 45 nr Centerville, TX"
1916,02245500,-81.8520426,29.9794075,USGS,"SOUTH FORK BLACK CREEK NEAR PENNEY FARMS, FL"
1917,0357587400,-86.5922056,34.77150864,USGS,"PINHOOK C AT MASTIN LAKE RD AT HUNTSVILLE, ALA"
1918,02266200,-81.6164632,28.38500749,USGS,"WHITTENHORSE CREEK NEAR VINELAND, FL"
1919,02013100,-80.00061319,37.7887362,USGS,"JACKSON RIVER BL DUNLAP CREEK AT COVINGTON, VA"
1920,02016500,-79.7844925,37.77374009,USGS,"JAMES RIVER AT LICK RUN, VA"
1921,02263800,-81.450905,28.3041775,USGS,"SHINGLE CREEK AT AIRPORT NEAR KISSIMMEE, FL"
1922,01589312,-76.7440833,39.29588889,USGS,"DEAD RUN NEAR CATONSVILLE, MD"
1923,50126150,-66.8414844,18.04721348,USGS,"RIO YAUCO ABV DIVERSION MONSERRATE NR YAUCO, PR"
1924,04287000,-72.6406655,44.1825606,USGS,"DOG RIVER AT NORTHFIELD FALLS, VT"
1925,02321975,-82.60845079999999,29.85273894,USGS,"SANTA FE RIVER AT US HWY 441 NEAR HIGH SPRINGS,FL."
1926,01413500,-74.65361109999999,42.144722200000004,USGS,EAST BRANCH DELAWARE RIVER AT MARGARETVILLE NY
1927,08033500,-94.39944440000001,31.025,USGS,"Neches Rv nr Rockland, TX"
1928,07367690,-91.4380556,33.00138889,USGS,Boeuf River at Ark/La State Line
1929,02309740,-82.59530600000001,28.22953268,USGS,ANCLOTE RIVER NEAR ODESSA FL
1930,0422027430,-77.71086109999999,43.19805556,USGS,ROUND POND CREEK AT STRAUB ROAD AT GREECE NY
1931,01638500,-77.54311109999999,39.2735833,USGS,"POTOMAC RIVER AT POINT OF ROCKS, MD"
1932,01208925,-73.2700083,41.165475,USGS,"MILL RIVER NEAR FAIRFIELD, CT"
1933,01646500,-77.12763889,38.94977778,USGS,"POTOMAC RIVER NEAR WASH, DC LITTLE FALLS PUMP STA"
1934,02266025,-81.61146309,28.405284499999997,USGS,"REEDY CREEK AT S-46 NEAR VINELAND, FL"
1935,02061500,-79.3036357,37.20847738,USGS,"BIG OTTER RIVER NEAR EVINGTON, VA"
1936,50129254,-66.8763204,18.0071818,USGS,"RIO LOCO AT LAS LATAS NR LA JOYA NR GUANICA, PR"
1937,01127000,-71.9840944,41.59749167,USGS,"QUINEBAUG RIVER AT JEWETT CITY, CT"
1938,07350500,-93.3529502,32.01266134,USGS,(COE) Red River at Coushatta
1939,07380106,-90.9541667,30.32055556,USGS,"Muddy Creek at Hwy 42 near Oak Grove, LA"
1940,02195470,-82.18338889,33.56736110000001,USGS,"UCHEE CREEK AT GA 104, NEAR EVANS, GA"
1941,07300000,-100.220949,34.95755294,USGS,"Salt Fork Red River near Wellington, TX"
1942,01029500,-68.5894444,45.73027778,USGS,"East Branch Penobscot River at Grindstone, Maine"
1943,01586000,-76.88438889,39.503,USGS,"NORTH BRANCH PATAPSCO RIVER AT CEDARHURST, MD"
1944,0423527080,-76.87752778,43.082583299999996,USGS,CLYDE RIVER (ERIE CANAL) AT CLYDE NY
1945,02062500,-78.9457222,37.03944444,USGS,"ROANOKE (STAUNTON) RIVER AT BROOKNEAL, VA"
1946,02336526,-84.4741944,33.7944722,USGS,"PROCTOR CREEK AT JACKSON PARKWAY, AT ATLANTA, GA"
1947,08162580,-96.2085194,28.97359167,USGS,"Juanita Ck at SH 71 nr Midfield, TX"
1948,01052500,-71.0575,44.8775,USGS,"Diamond River near Wentworth Location, NH"
1949,08123850,-100.762052,32.05374399,USGS,"Colorado Rv abv Silver, TX"
1950,01408120,-74.1525,40.09166667,USGS,North Branch Metedeconk River near Lakewood NJ
1951,02427506,-87.39777319,32.10014534,USGS,ALABAMA RIVER BELOW MILLERS FERRY L&D NR CAMDEN AL
1952,02356000,-84.5805,30.91030556,USGS,"FLINT RIVER AT BAINBRIDGE, GA"
1953,02258800,-81.0699806,27.15438056,USGS,"INDIAN PRAIRIE CANAL AB PUMP STA NR OKEECHOBEE, FL"
1954,02458148,-86.71887779999999,33.577048299999994,USGS,"VILLAGE CREEK AT 86TH ST NORTH AT ROEBUCK, AL."
1955,08111090,-96.3031722,30.22,USGS,"Rocky Ck at SH 105 nr Brenham, TX"
1956,02331000,-83.6360278,34.5770833,USGS,"CHATTAHOOCHEE RIVER NEAR LEAF, GA"
1957,08072760,-95.646612,29.86717035,USGS,"Langham Ck at W Little York Rd nr Addicks, TX"
1958,04243783,-75.7512222,43.095611100000006,USGS,COWASELON CREEK AT STATE ROUTE 13 AT CANASTOTA NY
1959,01597500,-79.12397220000001,39.50275,USGS,"SAVAGE RIV BL SAVAGE RIV DAM NEAR BLOOMINGTON, MD"
1960,02207300,-83.9966667,33.6925,USGS,"YELLOW RIVER AT MILSTEAD, GA"
1961,07374550,-89.3500536,29.274109499999998,USGS,"(COE) Mississippi River at Venice, LA"
1962,01151500,-72.35425819,43.60257077,USGS,"OTTAUQUECHEE RIVER AT NORTH HARTLAND, VT"
1963,07381600,-91.2119368,29.69281939,USGS,"Lower Atchafalaya River at Morgan City, LA"
1964,07348700,-93.39656,32.9945813,USGS,"Bayou Dorcheat near Springhill, LA"
1965,08068275,-95.64605590000001,30.11993899,USGS,"Spring Ck nr Tomball, TX"
1966,01440485,-75.32212759,41.09397946,USGS,"Swiftwater Creek at Swiftwater, PA"
1967,02151500,-81.6975,35.2108333,USGS,"BROAD RIVER NEAR BOILING SPRINGS, NC"
1968,0344894205,-82.33277779999999,35.68527778,USGS,"NORTH FORK SWANNANOA RIVER NEAR WALKERTOWN, NC"
1969,08031005,-93.9163444,30.13067778,USGS,"Cow Bayou at IH 10 nr Vidor, TX"
1970,50128945,-67.0785978,18.037215300000003,USGS,CANAL DE RIEGO DE LAJAS AT BO. PALMAREJO NR LAJAS
1971,02293987,-81.7267463,27.92474686,USGS,PEACE CREEK DRAINAGE CANAL NEAR WAHNETA FL
1972,02232415,-80.9283928,28.3525071,USGS,"TAYLOR CREEK NEAR COCOA, FL"
1973,01534860,-75.6421337,41.44119115,USGS,"Lackawanna R bl Leggetts Creek at Scranton, PA"
1974,02268390,-81.44428609999999,27.81215,USGS,TIGER CREEK NEAR BABSON PARK FL
1975,04216418,-78.2834167,42.86469444,USGS,TONAWANDA CREEK AT ATTICA NY
1976,01399500,-74.73027778,40.7275,USGS,Lamington (Black) River near Pottersville NJ
1977,01643700,-77.7966614,38.98649818,USGS,"GOOSE CREEK NEAR MIDDLEBURG, VA"
1978,02336030,-84.225,33.9058333,USGS,"N.F. PEACHTREE CREEK AT GRAVES RD, NR DORAVILLE,GA"
1979,02228000,-81.8664444,31.21958333,USGS,"SATILLA RIVER AT ATKINSON, GA"
1980,02011800,-79.94922369,37.94845825,USGS,"JACKSON RIVER BL GATHRIGHT DAM NR HOT SPGS, VA"
1981,08474108,-97.4528889,25.89402778,USGS,"N Main Drain at Manzano St, Brownsville, TX"
1982,03034500,-79.11003559999999,40.8361756,USGS,"Little Mahoning Creek at McCormick, PA"
1983,01572190,-76.53079699999999,40.4792558,USGS,"Swatara Creek near Inwood, PA"
1984,01382500,-74.4011111,41.0183333,USGS,Pequannock River at Macopin Intake Dam NJ
1985,07367047,-92.1345833,32.47616667,USGS,"Slough Bayou at Bancroft Blvd at West Monroe, La"
1986,08068450,-95.47771750000001,30.1343832,USGS,"Panther Br nr Spring, TX"
1987,03567340,-85.20527779999999,34.95755556,USGS,"WEST CHICKAMAUGA CR AT GA 146, NEAR LAKEVIEW, GA"
1988,08185000,-98.31112420000001,29.594116600000003,USGS,"Cibolo Ck at Selma, TX"
1989,08185500,-98.05333329999999,29.279722200000002,USGS,"Cibolo Ck at Sutherland Springs, TX"
1990,01403900,-74.50777778,40.585,USGS,Bound Brook at Middlesex NJ
1991,03085730,-80.08555559999999,40.50388889,USGS,Ohio River at Emsworth Dam Upper Pool @ Emsworth
1992,02300033,-82.42611109999999,27.42055556,USGS,BRADEN RIV AT LAKEWOOD RANCH NR LORRAINE FL
1993,02307674,-82.7131558,27.97550618,USGS,ALLIGATOR CREEK AT KAPOK PARK AT CLEARWATER FL
1994,02243959,-81.80480679,29.50858114,USGS,"OCKLAWAHA R AB RODMAN DAM NR ORANGE SPRINGS,FLA."
1995,02381401,-84.6747222,34.61416667,USGS,"CARTERS LAKE TAILRACE NEAR CARTERS, GA"
1996,02156300,-81.86871409999999,34.9481803,USGS,"LAWSONS FORK CREEK AT SPARTANBURG, SC"
1997,01158110,-72.279252,42.919247799999994,USGS,"ASHUELOT RIVER ABOVE THE BRANCH, AT KEENE, NH"
1998,03085500,-80.0964444,40.4006247,USGS,"Chartiers Creek at Carnegie, PA"
1999,08050840,-96.8072191,33.52622016,USGS,"Range Ck nr Collinsville, TX"
2000,02115360,-80.445275,36.1328861,USGS,"YADKIN RIVER AT ENON, NC"
2001,07312200,-98.9050666,33.90592785,USGS,"Beaver Ck nr Electra, TX"
2002,08111080,-95.99627779999999,30.35330556,USGS,"Grassy Ck at SH 105 nr Navasota, TX"
2003,08094800,-98.03281199999999,31.976536600000003,USGS,"N Bosque Rv at Hico, TX"
2004,01367715,-74.57861109999999,41.1333333,USGS,Wallkill R at Scott Road at Franklin NJ
2005,02309848,-82.55336109999999,28.18544444,USGS,SOUTH BRANCH ANCLOTE RIVER NEAR ODESSA FL
2006,08031000,-93.9085058,30.18632045,USGS,"Cow Bayou nr Mauriceville, TX"
2007,01573660,-76.7555556,40.1533333,USGS,"Fishing Creek at Goldsboro, PA"
2008,01105876,-70.6225338,41.94177039,USGS,"EEL RIVER AT RT 3A NEAR PLYMOUTH, MA"
2009,04292750,-73.14374670000001,44.7797674,USGS,"MILL RIVER AT GEORGIA SHORE RD, NR ST ALBANS, VT"
2010,0347927162,-81.90812220000001,36.21742778,USGS,"BUCKEYE CR ABOVE BUCKEYE LAKE NEAR CANNON GAP, NC"
2011,08084800,-99.642588,32.93094435,USGS,"California Ck nr Stamford, TX"
2012,02339495,-85.1963308,32.9015159,USGS,OSELIGEE CREEK NEAR LANETT AL
2013,01553990,-76.8024666,40.8528628,USGS,"Susquehanna River above Dam at Sunbury, PA"
2014,01387450,-74.1161111,41.1411111,USGS,Mahwah River near Suffern NY
2015,02142900,-80.9097222,35.3286111,USGS,"LONG CREEK NEAR PAW CREEK, NC"
2016,02479155,-89.0166667,31.02527778,USGS,"CYPRESS CREEK NR JANICE, MS"
2017,02207135,-84.1393333,33.83041667,USGS,"LITTLE STONE MTN CR NEAR STONE MOUNTAIN, GA"
2018,07351000,-93.82122220000001,32.37655556,USGS,"Boggy Byu nr Keithville, LA"
2019,01094500,-71.7219333,42.49506389,USGS,"NORTH NASHUA RIVER NEAR LEOMINSTER, MA"
2020,0242354750,-86.8063775,33.31344546,USGS,"CAHABA VALLEY CREEK AT CROSS CR RD AT PELHAM, AL."
2021,08105897,-97.46347220000001,30.46938889,USGS,"Brushy Ck at FM 973 nr Coupland, TX"
2022,50110900,-66.45739920000001,18.1245157,USGS,"RIO TOA VACA ABV LAGO TOA VACA, PR"
2023,02310700,-82.61787790000001,28.78526096,USGS,HOMOSASSA R AT HOMOSASSA FL
2024,02034000,-78.2658373,37.857919200000005,USGS,"RIVANNA RIVER AT PALMYRA, VA"
2025,02018000,-79.91143879999998,37.66596174,USGS,"CRAIG CREEK AT PARR, VA"
2026,02217475,-83.5630833,34.03180556,USGS,"MIDDLE OCONEE RIVER NEAR ARCADE, GA"
2027,07381350,-90.54480799999999,29.64521343,USGS,"Company Canal at Hwy 1 at Lockport, LA"
2028,02336340,-84.34525,33.89775,USGS,"NANCY CREEK AT JOHNSON FERRY RD, AT CHAMBLEE, GA"
2029,014755456,-75.2964972,39.96586667,USGS,"Naylor Creek at Upper Darby, PA"
2030,02370000,-86.7346786,30.8335197,USGS,"BLACKWATER RIVER NR BAKER, FLA."
2031,0810464660,-97.8492222,30.69775,USGS,"N Fk San Gabriel Rv at Reagan Blvd nr Leander, TX"
2032,01144000,-72.418149,43.71423614,USGS,"WHITE RIVER AT WEST HARTFORD, VT"
2033,01531500,-76.4407743,41.76535278,USGS,"Susquehanna River at Towanda, PA"
2034,01315226,-73.98836109999999,43.9485,USGS,VANDERWHACKER BROOK TRIB 1 NEAR BOREAS RIVER NY
2035,01465200,-75.0087083,40.25184167,USGS,"Neshaminy Creek near Penns Park, PA"
2036,02215000,-83.4623056,32.283,USGS,"OCMULGEE RIVER AT US 341, AT HAWKINSVILLE, GA"
2037,02223500,-82.8929722,32.54394444,USGS,"OCONEE RIVER AT DUBLIN, GA"
2038,01209901,-73.5492722,41.0661111,USGS,"RIPPOWAM RIVER AT STAMFORD, CT."
2039,08073600,-95.5577213,29.76217336,USGS,"Buffalo Bayou at W Belt Dr, Houston, TX"
2040,01482170,-75.5868611,39.65138889,USGS,"DELAWARE RIVER AT NEW CASTLE, DE"
2041,07274000,-89.5213889,34.2733333,USGS,"YOCONA RIVER NR OXFORD, MS"
2042,01108000,-70.9564307,41.9339903,USGS,"TAUNTON RIVER NEAR BRIDGEWATER, MA"
2043,04276500,-73.3944444,44.3583333,USGS,BOQUET RIVER AT WILLSBORO NY
2044,02308861,-82.7267672,27.873356899999997,USGS,CROSS BAYOU CNL AT CEDAR BRK DR AT PINELLAS PK FL
2045,02032515,-78.46056659999999,38.10180306,USGS,"S F RIVANNA RIVER NEAR CHARLOTTESVILLE, VA"
2046,01479000,-75.67502778,39.6992222,USGS,"WHITE CLAY CREEK NEAR NEWARK, DE"
2047,08188810,-96.8627635,28.47833444,USGS,"Guadalupe Rv at SH 35 nr Tivoli, TX"
2048,01110000,-71.71090229999999,42.230371999999996,USGS,"QUINSIGAMOND RIVER AT NORTH GRAFTON, MA"
2049,04235299,-76.434,42.7115833,USGS,OWASCO INLET BELOW AURORA STREET AT MORAVIA NY
2050,02376293,-87.52803840000001,30.97851588,USGS,"BRUSHY CREEK NEAR BRATT, FL"
2051,01351450,-74.25477778,42.7605833,USGS,SCHOHARIE CREEK AT ESPERANCE NY
2052,08162500,-96.0124588,28.9741462,USGS,"Colorado Rv nr Bay City, TX"
2053,08067585,-95.6972333,30.44693056,USGS,"Little Lake Ck at FM 149 nr Montgomery, TX"
2054,03031882,-79.08087009999998,41.15811918,USGS,"Redbank Creek at Brookville, PA"
2055,02407526,-86.45831319999999,33.24122519,USGS,COOSA RIVER AT GASTON STEAM PLANT NR WILSONVILLE
2056,08189700,-97.620829,28.28250426,USGS,"Aransas Rv nr Skidmore, TX"
2057,07375500,-90.36175240000001,30.50658047,USGS,"Tangipahoa River at Robert, LA"
2058,01650800,-77.00486109999999,38.9862222,USGS,"SLIGO CREEK NEAR TAKOMA PARK, MD"
2059,04234254,-77.29822220000001,43.0674722,USGS,GANARGUA CREEK AT MACEDON NY
2060,02246000,-81.9064915,30.113295299999997,USGS,"NORTH FORK BLACK CREEK NEAR MIDDLEBURG, FL"
2061,01412080,-74.9447222,39.37305556,USGS,Manumuskin River at Cumberland NJ
2062,02290766,-80.49597220000001,25.70216667,USGS,LEVEE 31 NORTH EXTENSION AT 4 MILE NR WEST MIAMI F
2063,08039100,-94.15102890000001,31.39629597,USGS,"Ayish Bayou nr San Augustine, TX"
2064,08111056,-96.2067,30.512411100000005,USGS,"Peach Ck at SH 6 nr Millican, TX"
2065,02217297,-83.71136109999999,34.0459722,USGS,"MULBERRY CREEK NEAR WINDER, GA"
2066,07375050,-90.17022220000001,30.494111100000005,USGS,"Tchefuncte River near Covington, LA"
2067,02274005,-80.8453388,27.37754217,USGS,"OTTER CREEK NEAR OKEECHOBEE, FL"
2068,01419500,-74.81277778,41.9033333,USGS,WILLOWEMOC CREEK NR LIVINGSTON MANOR NY
2069,02237293,-81.8725798,28.7444364,USGS,"PALATLAKAHA R AT STRUCTURE M-1, NR OKAHUMPKA, FL"
2070,02312000,-82.17758499,28.479998100000003,USGS,"WITHLACOOCHEE RIVER AT US 301 AT TRILBY, FL"
2071,01644380,-77.2885833,39.2066111,USGS,"CABIN BRANCH NEAR BOYDS, MD"
2072,01388000,-74.28,40.99194444,USGS,Ramapo River at Pompton Lakes NJ
2073,03039035,-79.58111109999999,40.71666667,USGS,"Allegheny River at Lock & Dam 6 at Clinton, PA"
2074,02073000,-79.8805946,36.6612486,USGS,"SMITH RIVER AT MARTINSVILLE, VA"
2075,08189585,-97.78062220000001,28.411425,USGS,"Poesta Ck at FM 351 nr Beeville, TX"
2076,01099500,-71.3020047,42.6367581,USGS,"CONCORD R BELOW R MEADOW BROOK, AT LOWELL, MA"
2077,01381000,-74.3947222,40.89694444,USGS,Rockaway River below Reservoir at Boonton NJ
2078,02220900,-83.4371111,33.31413889,USGS,"LITTLE RIVER NEAR EATONTON, GA"
2079,08189300,-97.656663,28.48305164,USGS,"Medio Ck nr Beeville, TX"
2080,02336313,-84.43863889,33.82163889,USGS,"WOODALL CREEK AT DEFOORS FERRY RD, AT ATLANTA, GA"
2081,02186702,-82.8005556,34.645,USGS,"EIGHTEENMILE CREEK BELOW PENDLETON, SC"
2082,08163900,-96.9865944,29.135436100000003,USGS,"Little Brushy Ck at US 77 nr Yoakum, TX"
2083,02197300,-81.61649799999999,33.3848664,USGS,"UPPER THREE RUNS NEAR NEW ELLENTON, SC"
2084,08136700,-99.5739532,31.49376898,USGS,"Colorado Rv nr Stacy, TX"
2085,01197145,-73.2451667,42.34288889,USGS,"HOUSATONIC RIVER AT LENOXDALE, MA"
2086,02375500,-87.2341395,30.96518304,USGS,"ESCAMBIA RIVER NEAR CENTURY, FL"
2087,04294140,-72.99194440000001,44.96305556,USGS,"ROCK RIVER NEAR HIGHGATE CENTER, VT"
2088,08375300,-102.97544090000001,29.1835386,USGS,"Rio Grande at Rio Grande Village, Big Bnd NP, TX"
2089,07364500,-91.8679054,32.87235338,USGS,"(COE) Bayou Bartholomew near Beekman, LA"
2090,02090380,-78.10972220000001,35.6911111,USGS,"CONTENTNEA CREEK NEAR LUCAMA, NC"
2091,01478137,-75.77910609999999,39.8217764,USGS,"Trout Run at Avondale, PA"
2092,03048500,-79.5519887,40.6045099,USGS,"Kiskiminetas River at Vandergrift, PA"
2093,04280000,-73.3115011,43.6242324,USGS,"POULTNEY RIVER BELOW FAIR HAVEN, VT"
2094,01454700,-75.23628808,40.6692656,USGS,"Lehigh River at Glendon, PA"
2095,0738022395,-90.9169444,30.26944444,USGS,"Black Bayou at Hwy 621 near Prairieville, LA"
2096,03175500,-80.8497993,37.30567654,USGS,"WOLF CREEK NEAR NARROWS, VA"
2097,50024950,-66.703716,18.300099499999998,USGS,"RIO GRANDE DE ARECIBO BLW UTUADO, PR"
2098,0423205010,-77.5119444,43.145,USGS,IRONDEQUOIT CR ABOVE BLOSSOM RD NEAR ROCHESTER NY
2099,08065700,-95.93566109999999,30.93716944,USGS,"Caney Ck nr Madisonville, TX"
2100,021623950,-82.3647222,35.1672222,USGS,"NORTH SALUDA RIVER NEAR HIGHLAND, SC"
2101,01472157,-75.60130500000001,40.15149064,USGS,"French Creek near Phoenixville, PA"
2102,01586210,-76.9029444,39.48944444,USGS,"BEAVER RUN NEAR FINKSBURG, MD"
2103,07378500,-90.99038,30.464078999999998,USGS,"Amite River near Denham Springs, LA"
2104,02450180,-86.92222109999999,33.87204689,USGS,"MULBERRY FORK NEAR ARKADELPHIA, AL."
2105,01359525,-73.846,42.64791667,USGS,NORMANS KILL AT KARLSFELD NY
2106,01471510,-75.9368333,40.3353611,USGS,"Schuylkill River at Reading, PA"
2107,01138500,-72.0417577,44.15339689,USGS,"CONNECTICUT RIVER AT WELLS RIVER, VT"
2108,02165200,-82.15705140000001,34.52011957,USGS,"SOUTH RABON CREEK NEAR GRAY COURT, SC"
2109,0214265808,-80.8827778,35.403611100000006,USGS,"TORRENCE CR AT BRADFORD HILL LN NR HUNTERSVLLE, NC"
2110,02397530,-85.45325,34.20194444,USGS,"COOSA RIVER AT STATE LINE, AL/GA"
2111,01589330,-76.71663889,39.3112222,USGS,"DEAD RUN AT FRANKLINTOWN, MD"
2112,02143000,-81.4033333,35.68444444,USGS,"HENRY FORK NEAR HENRY RIVER, NC"
2113,03022554,-80.10811329999999,41.69588905,USGS,"Woodcock Creek at Woodcock Creek Dam, PA"
2114,02465000,-87.5900074,33.20928528,USGS,BLACK WARRIOR RIVER AT NORTHPORT AL
2115,08044000,-97.6947538,33.23178218,USGS,"Big Sandy Ck nr Bridgeport, TX"
2116,08155400,-97.772228,30.26354168,USGS,"Barton Ck abv Barton Spgs at Austin, TX"
2117,04247000,-76.21777778,43.205361100000005,USGS,ONEIDA RIVER NEAR EUCLID NY
2118,02300100,-82.1978672,27.70475366,USGS,LITTLE MANATEE RIVER NEAR FT. LONESOME FL
2119,07378650,-91.04454799999999,30.440746299999997,USGS,"Jones Cr. at Old Hammond Hwy near Baton Rouge, LA"
2120,01467000,-74.6844444,39.97,USGS,North Branch Rancocas Creek at Pemberton NJ
2121,01114000,-71.41061208,41.833989,USGS,"MOSHASSUCK RIVER AT PROVIDENCE, RI"
2122,01480017,-75.65186109999999,39.72741667,USGS,"CALF RUN AT MARSHALLTON, DE"
2123,01195100,-72.5310333,41.3061722,USGS,"INDIAN RIVER NEAR CLINTON, CT"
2124,021720368,-79.8541111,33.0285,USGS,"FRENCH QUARTER CREEK NEAR HUGER, SC"
2125,08168797,-98.15483329999999,29.688000000000002,USGS,"Dry Comal Ck at Loop 337 nr New Braunfels, TX"
2126,08103940,-97.77852779999999,30.97252778,USGS,"Lampasas Rv at Ding Dong, TX"
2127,02088383,-78.3522222,35.82194444,USGS,"LITTLE RIVER NEAR ZEBULON, NC"
2128,02136000,-79.83613889,33.66225,USGS,"BLACK RIVER AT KINGSTREE, SC"
2129,02011500,-79.8970003,38.0695688,USGS,"BACK CREEK NEAR MOUNTAIN GROVE, VA"
2130,03512000,-83.3536111,35.46138889,USGS,"OCONALUFTEE RIVER AT BIRDTOWN, NC"
2131,03574100,-86.1683333,34.91,USGS,ESTILL FORK AT ESTILLFORK AL
2132,02011470,-79.81172,38.19040156,USGS,"BACK CREEK AT SUNRISE, VA"
2133,02376115,-87.3358086,30.49825159,USGS,"ELEVENMILE CREEK NR WEST PENSACOLA, FL"
2134,01034000,-68.8686111,45.26055556,USGS,"Piscataquis River at Medford, Maine"
2135,03028000,-78.69224919,41.57533955,USGS,"West Branch Clarion River at Wilcox, PA"
2136,03471500,-81.63122929,36.7603931,USGS,"S F HOLSTON RIVER AT RIVERSIDE, NEAR CHILHOWIE, VA"
2137,02485735,-90.1292532,32.33153417,USGS,"PEARL RIVER AT HWY 25 AT JACKSON, MS"
2138,07366497,-92.07172220000001,32.52941667,USGS,"Bayou DeSiard at NE Drive at Monroe, La"
2139,01096500,-71.57506809,42.66758945,USGS,"NASHUA RIVER AT EAST PEPPERELL, MA"
2140,01349711,-74.27711109999998,42.18505556,USGS,WEST KILL BELOW HUNTER BROOK NEAR SPRUCETON NY
2141,07288000,-90.575099,34.19733086,USGS,"BIG SUNFLOWER RIVER AT CLARKSDALE, MS"
2142,01208990,-73.39512029,41.294540000000005,USGS,"SAUGATUCK RIVER NEAR REDDING, CT"
2143,08187500,-97.85916800000001,28.81998007,USGS,"Escondido Ck at Kenedy, TX"
2144,01402630,-74.6230556,40.506111100000005,USGS,Royce Brook at Hamilton Road near Manville NJ
2145,08053025,-97.0046944,33.01469444,USGS,"Timber Ck at S. Edmonds Ln, Lewisville, TX"
2146,01407760,-74.0658333,40.2033333,USGS,Jumping Brook near Neptune City NJ
2147,01100505,-71.21506070000001,42.8492547,USGS,"SPICKET RIVER AT NORTH SALEM, NH"
2148,01380450,-74.4191667,40.9075,USGS,Rockaway River at Main Street at Boonton NJ
2149,07295000,-91.2955556,31.22694444,USGS,"BUFFALO RIVER NR WOODVILLE, MS"
2150,021989792,-81.13,32.16583333,USGS,"LITTLE BACK RIVER AT GA 25 AT PORT WENTWORTH, GA"
2151,02150495,-81.8725,35.40444444,USGS,"SECOND BROAD RIVER NR LOGAN, NC"
2152,08076990,-95.3520472,29.58546667,USGS,"Clear Ck at FM 865 nr Pearland, TX"
2153,50026025,-66.6367066,18.229427899999997,USGS,"RIO CAONILLAS AT PASO PALMA, PR"
2154,50095000,-66.11516568,18.00107654,USGS,"CANAL DE GUAMANI OESTE AT HWY 15 GUAYAMA, PR"
2155,08129300,-100.6403767,31.33016396,USGS,"Spring Ck abv Tankersley, TX"
2156,01462500,-74.8680556,40.295,USGS,Delaware River at Washington Crossing NJ
2157,02296389,-81.69569440000001,27.411861100000003,USGS,OAK CREEK NEAR GARDNER FL
2158,295501090190400,-90.31777779999999,29.91694444,USGS,"Davis Pond Freshwater Diversion near Boutte, LA"
2159,01464000,-74.7491667,40.22416667,USGS,Assunpink Creek at Trenton NJ
2160,01573849,-77.1546111,39.9802222,USGS,"Bermudian Creek at Oxford Road nr Heidlersburg, PA"
2161,08067656,-95.46918609999999,30.31373056,USGS,"Alligator Ck at TX 105, Conroe, TX"
2162,08083100,-100.3887183,32.78760777,USGS,"Clear Fk Brazos Rv nr Roby, TX"
2163,04235440,-76.5635556,42.93238889,USGS,"OWASCO OUTLET AT GENESEE ST., AUBURN NY"
2164,03164000,-80.97896899999999,36.64734970000001,USGS,"NEW RIVER NEAR GALAX, VA"
2165,02208050,-83.9391667,33.97855556,USGS,"ALCOVY RIVER NEAR LAWRENCEVILLE, GA"
2166,01545000,-77.873882,41.31950954,USGS,"Kettle Creek near Westport, PA"
2167,08160800,-96.5321933,29.79911967,USGS,"Redgate Ck nr Columbus, TX"
2168,01595500,-79.1816944,39.39388889,USGS,"NORTH BRANCH POTOMAC RIVER AT KITZMILLER, MD"
2169,02111180,-81.4030556,36.07138889,USGS,"ELK CREEK AT ELKVILLE, NC"
2170,03572900,-85.9902524,34.3784235,USGS,TOWN CREEK NEAR GERALDINE AL
2171,01013500,-68.58277778,47.2375,USGS,"Fish River near Fort Kent, Maine"
